{
  "id": "CVE-2022-36765",
  "cocciFile": "cocci-scripts/past-cves/CVE-2022-36765-createhob-overflow.cocci",
  "spatchOptions": [
    "--max-width", "200"
  ],
  "cases": [
    {
      "name": "replay-EmbeddedPkg-PrePiHobLib",
      "beforeSource": {
        "gitRevision": "aeaee8944f^:EmbeddedPkg/Library/PrePiHobLib/Hob.c"
      },
      "afterSource": {
        "gitRevision": "aeaee8944f:EmbeddedPkg/Library/PrePiHobLib/Hob.c",
        "ranges": [
          { "startLine": 1, "endLine": 112 },
          { "startLine": 116, "endLine": 881 }
        ]
      }
    },
    {
      "name": "replay-StandaloneMmPkg-CoreHobLib",
      "beforeSource": {
        "gitRevision": "9a75b030cf^:StandaloneMmPkg/Library/StandaloneMmCoreHobLib/Arm/StandaloneMmCoreHobLib.c"
      },
      "afterSource": {
        "gitRevision": "9a75b030cf:StandaloneMmPkg/Library/StandaloneMmCoreHobLib/Arm/StandaloneMmCoreHobLib.c",
        "ranges": [
          { "startLine": 1, "endLine": 36 },
          { "startLine": 40, "endLine": 366 }
        ]
      }
    },
    {
      "name": "replay-UefiPayloadPkg-PayloadEntryHobLib",
      "beforeSource": {
        "gitRevision": "59f024c76e^:UefiPayloadPkg/Library/PayloadEntryHobLib/Hob.c"
      },
      "afterSource": {
        "gitRevision": "59f024c76e:UefiPayloadPkg/Library/PayloadEntryHobLib/Hob.c",
        "ranges": [
          { "startLine": 1, "endLine": 112 },
          { "startLine": 116, "endLine": 719 }
        ]
      }
    },
    {
      "name": "replay-UefiPayloadPkg-FitUniversalPayloadEntry",
      "beforeSource": {
        "gitRevision": "59f024c76e^:UefiPayloadPkg/UefiPayloadEntry/FitUniversalPayloadEntry.c"
      },
      "afterSource": {
        "gitRevision": "59f024c76e:UefiPayloadPkg/UefiPayloadEntry/FitUniversalPayloadEntry.c"
      }
    },
    {
      "name": "replay-UefiPayloadPkg-UniversalPayloadEntry",
      "beforeSource": {
        "gitRevision": "59f024c76e^:UefiPayloadPkg/UefiPayloadEntry/UniversalPayloadEntry.c"
      },
      "afterSource": {
        "gitRevision": "59f024c76e:UefiPayloadPkg/UefiPayloadEntry/UniversalPayloadEntry.c"
      }
    }
  ]
}
