{
  "id": "CVE-2022-36764",
  "cocciFile": "cocci-scripts/past-cves/CVE-2022-36764-tcg2-peimage-eventsize.cocci",
  "spatchOptions": [
    "--max-width", "200"
  ],
  "cases": [
    {
      "name": "replay-DxeTpmMeasureBootLib-TcgMeasurePeImage",
      "beforeSource": {
        "gitRevision": "0d341c01ee^:SecurityPkg/Library/DxeTpmMeasureBootLib/DxeTpmMeasureBootLib.c",
        "ranges": [
          { "startLine": 1, "endLine": 349 },
          { "startLine": 351, "endLine": 1027 }
        ]
      },
      "afterSource": {
        "gitRevision": "0d341c01ee:SecurityPkg/Library/DxeTpmMeasureBootLib/DxeTpmMeasureBootLib.c",
        "ranges": [
          { "startLine": 1, "endLine": 19 },
          { "startLine": 21, "endLine": 1032 }
        ]
      }
    },
    {
      "name": "replay-DxeTpm2MeasureBootLib-Tcg2MeasurePeImage",
      "beforeSource": {
        "gitRevision": "c7b2794421^:SecurityPkg/Library/DxeTpm2MeasureBootLib/DxeTpm2MeasureBootLib.c"
      },
      "afterSource": {
        "gitRevision": "c7b2794421:SecurityPkg/Library/DxeTpm2MeasureBootLib/DxeTpm2MeasureBootLib.c",
        "ranges": [
          { "startLine": 1, "endLine": 430 },
          { "startLine": 432, "endLine": 918 }
        ]
      }
    }
  ]
}
