{
  "id": "CVE-2023-45237",
  "cocciFile": "cocci-scripts/past-cves/CVE-2023-45237-weak-prng-migration.cocci",
  "spatchOptions": [
    "--max-width", "200"
  ],
  "cases": [
    {
      "name": "replay-dhcp4driver",
      "beforeSource": {
        "gitRevision": "4c4ceb2ceb^:NetworkPkg/Dhcp4Dxe/Dhcp4Driver.c"
      },
      "afterSource": {
        "fixturePath": "cocci-scripts/tests/fixtures/CVE-2023-45237/Dhcp4Driver.after.c"
      }
    },
    {
      "name": "replay-dhcp6driver",
      "beforeSource": {
        "gitRevision": "4c4ceb2ceb^:NetworkPkg/Dhcp6Dxe/Dhcp6Driver.c"
      },
      "afterSource": {
        "fixturePath": "cocci-scripts/tests/fixtures/CVE-2023-45237/Dhcp6Driver.after.c"
      }
    },
    {
      "name": "replay-udp4driver",
      "beforeSource": {
        "gitRevision": "4c4ceb2ceb^:NetworkPkg/Udp4Dxe/Udp4Driver.c"
      },
      "afterSource": {
        "fixturePath": "cocci-scripts/tests/fixtures/CVE-2023-45237/Udp4Driver.after.c"
      }
    },
    {
      "name": "replay-udp6driver",
      "beforeSource": {
        "gitRevision": "4c4ceb2ceb^:NetworkPkg/Udp6Dxe/Udp6Driver.c"
      },
      "afterSource": {
        "fixturePath": "cocci-scripts/tests/fixtures/CVE-2023-45237/Udp6Driver.after.c"
      }
    },
    {
      "name": "replay-ip6mld",
      "beforeSource": {
        "gitRevision": "4c4ceb2ceb^:NetworkPkg/Ip6Dxe/Ip6Mld.c"
      },
      "afterSource": {
        "gitRevision": "4c4ceb2ceb:NetworkPkg/Ip6Dxe/Ip6Mld.c"
      }
    },
    {
      "name": "replay-ip6configimpl",
      "beforeSource": {
        "gitRevision": "4c4ceb2ceb^:NetworkPkg/Ip6Dxe/Ip6ConfigImpl.c"
      },
      "afterSource": {
        "gitRevision": "4c4ceb2ceb:NetworkPkg/Ip6Dxe/Ip6ConfigImpl.c"
      }
    },
    {
      "name": "replay-pxebcdhcp6",
      "beforeSource": {
        "gitRevision": "4c4ceb2ceb^:NetworkPkg/UefiPxeBcDxe/PxeBcDhcp6.c"
      },
      "afterSource": {
        "gitRevision": "4c4ceb2ceb:NetworkPkg/UefiPxeBcDxe/PxeBcDhcp6.c"
      }
    },
    {
      "name": "replay-dnsimpl",
      "beforeSource": {
        "gitRevision": "4c4ceb2ceb^:NetworkPkg/DnsDxe/DnsImpl.c"
      },
      "afterSource": {
        "gitRevision": "4c4ceb2ceb:NetworkPkg/DnsDxe/DnsImpl.c",
        "ranges": [
          { "startLine": 1, "endLine": 4 },
          { "startLine": 6, "endLine": 2275 }
        ]
      }
    },
    {
      "name": "replay-ip6if",
      "beforeSource": {
        "gitRevision": "4c4ceb2ceb^:NetworkPkg/Ip6Dxe/Ip6If.c"
      },
      "afterSource": {
        "gitRevision": "4c4ceb2ceb:NetworkPkg/Ip6Dxe/Ip6If.c",
        "ranges": [
          { "startLine": 1, "endLine": 4 },
          { "startLine": 6, "endLine": 798 }
        ]
      }
    },
    {
      "name": "replay-ip4driver",
      "beforeSource": {
        "gitRevision": "4c4ceb2ceb^:NetworkPkg/Ip4Dxe/Ip4Driver.c"
      },
      "afterSource": {
        "gitRevision": "4c4ceb2ceb:NetworkPkg/Ip4Dxe/Ip4Driver.c",
        "ranges": [
          { "startLine": 1, "endLine": 4 },
          { "startLine": 6, "endLine": 1073 }
        ]
      }
    },
    {
      "name": "replay-dnsdhcp",
      "beforeSource": {
        "gitRevision": "4c4ceb2ceb^:NetworkPkg/DnsDxe/DnsDhcp.c"
      },
      "afterSource": {
        "gitRevision": "4c4ceb2ceb:NetworkPkg/DnsDxe/DnsDhcp.c",
        "ranges": [
          { "startLine": 1, "endLine": 4 },
          { "startLine": 6, "endLine": 761 }
        ]
      }
    },
    {
      "name": "replay-httpbootdhcp6",
      "beforeSource": {
        "gitRevision": "4c4ceb2ceb^:NetworkPkg/HttpBootDxe/HttpBootDhcp6.c"
      },
      "afterSource": {
        "gitRevision": "4c4ceb2ceb:NetworkPkg/HttpBootDxe/HttpBootDhcp6.c",
        "ranges": [
          { "startLine": 1, "endLine": 4 },
          { "startLine": 6, "endLine": 1052 }
        ]
      }
    },
    {
      "name": "replay-tcpdriver",
      "beforeSource": {
        "gitRevision": "4c4ceb2ceb^:NetworkPkg/TcpDxe/TcpDriver.c"
      },
      "afterSource": {
        "gitRevision": "4c4ceb2ceb:NetworkPkg/TcpDxe/TcpDriver.c",
        "ranges": [
          { "startLine": 1, "endLine": 4 },
          { "startLine": 6, "endLine": 995 }
        ]
      }
    },
    {
      "name": "replay-pxebcdhcp4",
      "beforeSource": {
        "gitRevision": "4c4ceb2ceb^:NetworkPkg/UefiPxeBcDxe/PxeBcDhcp4.c"
      },
      "afterSource": {
        "gitRevision": "4c4ceb2ceb:NetworkPkg/UefiPxeBcDxe/PxeBcDhcp4.c",
        "ranges": [
          { "startLine": 1, "endLine": 4 },
          { "startLine": 6, "endLine": 1762 }
        ]
      }
    },
    {
      "name": "replay-ip6driver",
      "beforeSource": {
        "gitRevision": "4c4ceb2ceb^:NetworkPkg/Ip6Dxe/Ip6Driver.c"
      },
      "afterSource": {
        "gitRevision": "4c4ceb2ceb:NetworkPkg/Ip6Dxe/Ip6Driver.c",
        "ranges": [
          { "startLine": 1, "endLine": 5 },
          { "startLine": 7, "endLine": 1064 }
        ]
      }
    },
    {
      "name": "replay-iscsichap",
      "beforeSource": {
        "gitRevision": "4c4ceb2ceb^:NetworkPkg/IScsiDxe/IScsiCHAP.c"
      },
      "afterSource": {
        "gitRevision": "4c4ceb2ceb:NetworkPkg/IScsiDxe/IScsiCHAP.c",
        "ranges": [
          { "startLine": 1, "endLine": 5 },
          { "startLine": 7, "endLine": 682 }
        ]
      }
    },
    {
      "name": "replay-netlib-h",
      "beforeSource": {
        "gitRevision": "4c4ceb2ceb^:NetworkPkg/Include/Library/NetLib.h"
      },
      "afterSource": {
        "fixturePath": "cocci-scripts/tests/fixtures/CVE-2023-45237/NetLib.after.h"
      }
    },
    {
      "name": "replay-iscsimisc-c",
      "beforeSource": {
        "gitRevision": "4c4ceb2ceb^:NetworkPkg/IScsiDxe/IScsiMisc.c"
      },
      "afterSource": {
        "gitRevision": "4c4ceb2ceb:NetworkPkg/IScsiDxe/IScsiMisc.c",
        "ranges": [
          { "startLine": 1, "endLine": 4 },
          { "startLine": 6, "endLine": 477 },
          { "startLine": 481, "endLine": 2605 }
        ]
      }
    },
    {
      "name": "replay-iscsimisc-h",
      "beforeSource": {
        "gitRevision": "4c4ceb2ceb^:NetworkPkg/IScsiDxe/IScsiMisc.h"
      },
      "afterSource": {
        "gitRevision": "4c4ceb2ceb:NetworkPkg/IScsiDxe/IScsiMisc.h",
        "ranges": [
          { "startLine": 1, "endLine": 4 },
          { "startLine": 6, "endLine": 205 },
          { "startLine": 209, "endLine": 473 }
        ]
      }
    },
    {
      "name": "replay-ip6nd-c",
      "beforeSource": {
        "gitRevision": "4c4ceb2ceb^:NetworkPkg/Ip6Dxe/Ip6Nd.c"
      },
      "afterSource": {
        "gitRevision": "4c4ceb2ceb:NetworkPkg/Ip6Dxe/Ip6Nd.c",
        "ranges": [
          { "startLine": 1, "endLine": 4 },
          { "startLine": 6, "endLine": 18 },
          { "startLine": 21, "endLine": 3194 }
        ]
      }
    },
    {
      "name": "replay-ip6nd-h",
      "beforeSource": {
        "gitRevision": "4c4ceb2ceb^:NetworkPkg/Ip6Dxe/Ip6Nd.h",
        "ranges": [
          { "startLine": 1, "endLine": 782 },
          { "startLine": 785, "endLine": 791 }
        ]
      },
      "afterSource": {
        "gitRevision": "4c4ceb2ceb:NetworkPkg/Ip6Dxe/Ip6Nd.h",
        "ranges": [
          { "startLine": 1, "endLine": 4 },
          { "startLine": 6, "endLine": 782 },
          { "startLine": 785, "endLine": 791 }
        ]
      }
    },
    {
      "name": "replay-pxebcdriver",
      "beforeSource": {
        "gitRevision": "4c4ceb2ceb^:NetworkPkg/UefiPxeBcDxe/PxeBcDriver.c",
        "ranges": [
          { "startLine": 1, "endLine": 937 },
          { "startLine": 939, "endLine": 1848 }
        ]
      },
      "afterSource": {
        "gitRevision": "4c4ceb2ceb:NetworkPkg/UefiPxeBcDxe/PxeBcDriver.c",
        "ranges": [
          { "startLine": 1, "endLine": 5 },
          { "startLine": 7, "endLine": 945 },
          { "startLine": 947, "endLine": 1856 }
        ]
      }
    },
    {
      "name": "replay-dxenetlib-c",
      "beforeSource": {
        "gitRevision": "4c4ceb2ceb^:NetworkPkg/Library/DxeNetLib/DxeNetLib.c"
      },
      "afterSource": {
        "fixturePath": "cocci-scripts/tests/fixtures/CVE-2023-45237/DxeNetLib.after.c"
      }
    }
  ]
}
