{
  "id": "CVE-2025-2295",
  "cocciFile": "cocci-scripts/past-cves/CVE-2025-2295-iscsi-r2t-overflow.cocci",
  "spatchOptions": [
    "--max-width", "200"
  ],
  "cases": [
    {
      "name": "replay-IScsiProto.c-IScsiOnR2TRcvd",
      "beforeSource": {
        "gitRevision": "17cdc512f0^:NetworkPkg/IScsiDxe/IScsiProto.c",
        "ranges": [
          {
            "startLine": 2673,
            "endLine": 2729
          }
        ]
      },
      "afterSource": {
        "gitRevision": "17cdc512f0:NetworkPkg/IScsiDxe/IScsiProto.c",
        "ranges": [
          {
            "startLine": 2673,
            "endLine": 2735
          }
        ]
      }
    }
  ]
}
