{
  "id": "CVE-2023-45235",
  "cocciFile": "cocci-scripts/past-cves/CVE-2023-45235-pxebc-dhcp6-serverid-overflow.cocci",
  "spatchOptions": [
    "--max-width", "200"
  ],
  "cases": [
    {
      "name": "replay-PxeBcDhcp6.c",
      "beforeSource": {
        "gitRevision": "fac297724e^:NetworkPkg/UefiPxeBcDxe/PxeBcDhcp6.c"
      },
      "afterSource": {
        "fixturePath": "cocci-scripts/tests/fixtures/CVE-2023-45235/PxeBcDhcp6.after.c"
      }
    },
    {
      "name": "replay-PxeBcDhcp6.h",
      "beforeSource": {
        "gitRevision": "fac297724e^:NetworkPkg/UefiPxeBcDxe/PxeBcDhcp6.h"
      },
      "afterSource": {
        "fixturePath": "cocci-scripts/tests/fixtures/CVE-2023-45235/PxeBcDhcp6.after.h"
      }
    }
  ]
}
