{
  "id": "CVE-2023-45230",
  "cocciFile": "cocci-scripts/past-cves/CVE-2023-45230-dhcp6-serverid-overflow.cocci",
  "spatchOptions": [
    "--max-width", "200",
    "--smpl-spacing"
  ],
  "cases": [
    {
      "name": "replay-dhcp6io-solicit",
      "beforeSource": {
        "gitRevision": "f31453e8d6542461d92d835e0b79fec8b039174d^:NetworkPkg/Dhcp6Dxe/Dhcp6Io.c",
        "ranges": [
          { "startLine": 897, "endLine": 1023 }
        ]
      },
      "afterSource": {
        "gitRevision": "f31453e8d6542461d92d835e0b79fec8b039174d:NetworkPkg/Dhcp6Dxe/Dhcp6Io.c",
        "ranges": [
          { "startLine": 897, "endLine": 1040 }
        ]
      }
    },
    {
      "name": "replay-dhcp6io-request",
      "beforeSource": {
        "gitRevision": "f31453e8d6542461d92d835e0b79fec8b039174d^:NetworkPkg/Dhcp6Dxe/Dhcp6Io.c",
        "ranges": [
          { "startLine": 1058, "endLine": 1205 }
        ]
      },
      "afterSource": {
        "gitRevision": "f31453e8d6542461d92d835e0b79fec8b039174d:NetworkPkg/Dhcp6Dxe/Dhcp6Io.c",
        "ranges": [
          { "startLine": 1075, "endLine": 1245 }
        ]
      }
    },
    {
      "name": "replay-dhcp6io-decline",
      "beforeSource": {
        "gitRevision": "f31453e8d6542461d92d835e0b79fec8b039174d^:NetworkPkg/Dhcp6Dxe/Dhcp6Io.c",
        "ranges": [
          { "startLine": 1219, "endLine": 1342 }
        ]
      },
      "afterSource": {
        "gitRevision": "f31453e8d6542461d92d835e0b79fec8b039174d:NetworkPkg/Dhcp6Dxe/Dhcp6Io.c",
        "ranges": [
          { "startLine": 1259, "endLine": 1405 }
        ]
      }
    },
    {
      "name": "replay-dhcp6io-release",
      "beforeSource": {
        "gitRevision": "f31453e8d6542461d92d835e0b79fec8b039174d^:NetworkPkg/Dhcp6Dxe/Dhcp6Io.c",
        "ranges": [
          { "startLine": 1356, "endLine": 1474 }
        ]
      },
      "afterSource": {
        "gitRevision": "f31453e8d6542461d92d835e0b79fec8b039174d:NetworkPkg/Dhcp6Dxe/Dhcp6Io.c",
        "ranges": [
          { "startLine": 1419, "endLine": 1560 }
        ]
      }
    },
    {
      "name": "replay-dhcp6io-renewrebind",
      "beforeSource": {
        "gitRevision": "f31453e8d6542461d92d835e0b79fec8b039174d^:NetworkPkg/Dhcp6Dxe/Dhcp6Io.c",
        "ranges": [
          { "startLine": 1489, "endLine": 1651 }
        ]
      },
      "afterSource": {
        "gitRevision": "f31453e8d6542461d92d835e0b79fec8b039174d:NetworkPkg/Dhcp6Dxe/Dhcp6Io.c",
        "ranges": [
          { "startLine": 1575, "endLine": 1758 }
        ]
      }
    },
    {
      "name": "replay-dhcp6io-inforequest",
      "beforeSource": {
        "gitRevision": "f31453e8d6542461d92d835e0b79fec8b039174d^:NetworkPkg/Dhcp6Dxe/Dhcp6Io.c",
        "ranges": [
          { "startLine": 1772, "endLine": 1890 }
        ]
      },
      "afterSource": {
        "gitRevision": "f31453e8d6542461d92d835e0b79fec8b039174d:NetworkPkg/Dhcp6Dxe/Dhcp6Io.c",
        "ranges": [
          { "startLine": 1879, "endLine": 2016 }
        ]
      }
    },
    {
      "name": "replay-dhcp6io-confirm",
      "beforeSource": {
        "gitRevision": "f31453e8d6542461d92d835e0b79fec8b039174d^:NetworkPkg/Dhcp6Dxe/Dhcp6Io.c",
        "ranges": [
          { "startLine": 1903, "endLine": 2025 }
        ]
      },
      "afterSource": {
        "gitRevision": "f31453e8d6542461d92d835e0b79fec8b039174d:NetworkPkg/Dhcp6Dxe/Dhcp6Io.c",
        "ranges": [
          { "startLine": 2029, "endLine": 2168 }
        ]
      }
    },
    {
      "name": "replay-dhcp6utility-append-option-def",
      "beforeSource": {
        "gitRevision": "f31453e8d6542461d92d835e0b79fec8b039174d^:NetworkPkg/Dhcp6Dxe/Dhcp6Utility.c",
        "ranges": [
          { "startLine": 590, "endLine": 620 }
        ]
      },
      "afterSource": {
        "fixturePath": "cocci-scripts/tests/fixtures/CVE-2023-45230/Dhcp6Utility.ao.after.c"
      }
    },
    {
      "name": "replay-dhcp6utility-append-iaaddr-option-def",
      "beforeSource": {
        "gitRevision": "f31453e8d6542461d92d835e0b79fec8b039174d^:NetworkPkg/Dhcp6Dxe/Dhcp6Utility.c",
        "ranges": [
          { "startLine": 632, "endLine": 690 }
        ]
      },
      "afterSource": {
        "fixturePath": "cocci-scripts/tests/fixtures/CVE-2023-45230/Dhcp6Utility.iaaddr.after.c"
      }
    },
    {
      "name": "replay-dhcp6utility-append-ia-option-def",
      "beforeSource": {
        "gitRevision": "f31453e8d6542461d92d835e0b79fec8b039174d^:NetworkPkg/Dhcp6Dxe/Dhcp6Utility.c",
        "ranges": [
          { "startLine": 704, "endLine": 778 }
        ]
      },
      "afterSource": {
        "fixturePath": "cocci-scripts/tests/fixtures/CVE-2023-45230/Dhcp6Utility.ia.after.c"
      }
    },
    {
      "name": "replay-dhcp6utility-append-et-option-def",
      "beforeSource": {
        "gitRevision": "f31453e8d6542461d92d835e0b79fec8b039174d^:NetworkPkg/Dhcp6Dxe/Dhcp6Utility.c",
        "ranges": [
          { "startLine": 791, "endLine": 830 }
        ]
      },
      "afterSource": {
        "fixturePath": "cocci-scripts/tests/fixtures/CVE-2023-45230/Dhcp6Utility.et.after.c"
      }
    },
    {
      "name": "replay-dhcp6impl-h-size-macros",
      "beforeSource": {
        "gitRevision": "f31453e8d6542461d92d835e0b79fec8b039174d^:NetworkPkg/Dhcp6Dxe/Dhcp6Impl.h",
        "ranges": [
          { "startLine": 45, "endLine": 48 }
        ]
      },
      "afterSource": {
        "fixturePath": "cocci-scripts/tests/fixtures/CVE-2023-45230/Dhcp6Impl.h.after.h"
      }
    },
    {
      "name": "replay-dhcp6utility-h-prototypes",
      "beforeSource": {
        "gitRevision": "f31453e8d6542461d92d835e0b79fec8b039174d^:NetworkPkg/Dhcp6Dxe/Dhcp6Utility.h",
        "ranges": [
          { "startLine": 173, "endLine": 179 },
          { "startLine": 193, "endLine": 200 },
          { "startLine": 213, "endLine": 218 }
        ]
      },
      "afterSource": {
        "gitRevision": "f31453e8d6542461d92d835e0b79fec8b039174d:NetworkPkg/Dhcp6Dxe/Dhcp6Utility.h",
        "ranges": [
          { "startLine": 177, "endLine": 184 },
          { "startLine": 202, "endLine": 210 },
          { "startLine": 227, "endLine": 233 }
        ]
      }
    }
  ]
}
