{
  "id": "CVE-2024-1298",
  "cocciFile": "cocci-scripts/past-cves/CVE-2024-1298-s3-resumecount-overflow.cocci",
  "spatchOptions": [
    "--max-width", "200"
  ],
  "cases": [
    {
      "name": "replay-firmwareperformancepei",
      "beforeSource": {
        "gitRevision": "284dbac43da752ee34825c8b3f6f9e8281cb5a19^:MdeModulePkg/Universal/Acpi/FirmwarePerformanceDataTablePei/FirmwarePerformancePei.c"
      },
      "afterSource": {
        "gitRevision": "284dbac43da752ee34825c8b3f6f9e8281cb5a19:MdeModulePkg/Universal/Acpi/FirmwarePerformanceDataTablePei/FirmwarePerformancePei.c"
      }
    }
  ]
}
