{
  "id": "CVE-2023-45229",
  "cocciFile": "cocci-scripts/past-cves/CVE-2023-45229-dhcp6-iana-oob.cocci",
  "spatchOptions": [
    "--max-width", "200"
  ],
  "cases": [
    {
      "name": "replay-Dhcp6Io.c-Dhcp6UpdateIaInfo",
      "beforeSource": {
        "gitRevision": "1dbb10cc52dc8ef49bb700daa1cefc76b26d52e0^:NetworkPkg/Dhcp6Dxe/Dhcp6Io.c",
        "ranges": [ { "startLine": 523, "endLine": 662 } ]
      },
      "afterSource": {
        "gitRevision": "1dbb10cc52dc8ef49bb700daa1cefc76b26d52e0:NetworkPkg/Dhcp6Dxe/Dhcp6Io.c",
        "ranges": [ { "startLine": 523, "endLine": 663 } ]
      }
    },
    {
      "name": "replay-Dhcp6Io.c-Dhcp6SendRequestMsg",
      "beforeSource": {
        "gitRevision": "1dbb10cc52dc8ef49bb700daa1cefc76b26d52e0^:NetworkPkg/Dhcp6Dxe/Dhcp6Io.c",
        "ranges": [ { "startLine": 1075, "endLine": 1245 } ]
      },
      "afterSource": {
        "gitRevision": "1dbb10cc52dc8ef49bb700daa1cefc76b26d52e0:NetworkPkg/Dhcp6Dxe/Dhcp6Io.c",
        "ranges": [ { "startLine": 1146, "endLine": 1316 } ]
      }
    },
    {
      "name": "replay-Dhcp6Io.c-Dhcp6SendDeclineMsg",
      "beforeSource": {
        "gitRevision": "1dbb10cc52dc8ef49bb700daa1cefc76b26d52e0^:NetworkPkg/Dhcp6Dxe/Dhcp6Io.c",
        "ranges": [ { "startLine": 1259, "endLine": 1405 } ]
      },
      "afterSource": {
        "gitRevision": "1dbb10cc52dc8ef49bb700daa1cefc76b26d52e0:NetworkPkg/Dhcp6Dxe/Dhcp6Io.c",
        "ranges": [ { "startLine": 1330, "endLine": 1476 } ]
      }
    },
    {
      "name": "replay-Dhcp6Io.c-Dhcp6SendReleaseMsg",
      "beforeSource": {
        "gitRevision": "1dbb10cc52dc8ef49bb700daa1cefc76b26d52e0^:NetworkPkg/Dhcp6Dxe/Dhcp6Io.c",
        "ranges": [ { "startLine": 1419, "endLine": 1560 } ]
      },
      "afterSource": {
        "gitRevision": "1dbb10cc52dc8ef49bb700daa1cefc76b26d52e0:NetworkPkg/Dhcp6Dxe/Dhcp6Io.c",
        "ranges": [ { "startLine": 1490, "endLine": 1631 } ]
      }
    },
    {
      "name": "replay-Dhcp6Io.c-Dhcp6SendRenewRebindMsg",
      "beforeSource": {
        "gitRevision": "1dbb10cc52dc8ef49bb700daa1cefc76b26d52e0^:NetworkPkg/Dhcp6Dxe/Dhcp6Io.c",
        "ranges": [ { "startLine": 1575, "endLine": 1758 } ]
      },
      "afterSource": {
        "gitRevision": "1dbb10cc52dc8ef49bb700daa1cefc76b26d52e0:NetworkPkg/Dhcp6Dxe/Dhcp6Io.c",
        "ranges": [ { "startLine": 1646, "endLine": 1829 } ]
      }
    },
    {
      "name": "replay-Dhcp6Io.c-Dhcp6HandleReplyMsg",
      "beforeSource": {
        "gitRevision": "1dbb10cc52dc8ef49bb700daa1cefc76b26d52e0^:NetworkPkg/Dhcp6Dxe/Dhcp6Io.c",
        "ranges": [ { "startLine": 2182, "endLine": 2435 } ]
      },
      "afterSource": {
        "gitRevision": "1dbb10cc52dc8ef49bb700daa1cefc76b26d52e0:NetworkPkg/Dhcp6Dxe/Dhcp6Io.c",
        "ranges": [ { "startLine": 2253, "endLine": 2506 } ]
      }
    },
    {
      "name": "replay-Dhcp6Io.c-Dhcp6SelectAdvertiseMsg",
      "beforeSource": {
        "gitRevision": "1dbb10cc52dc8ef49bb700daa1cefc76b26d52e0^:NetworkPkg/Dhcp6Dxe/Dhcp6Io.c",
        "ranges": [ { "startLine": 2448, "endLine": 2517 } ]
      },
      "afterSource": {
        "gitRevision": "1dbb10cc52dc8ef49bb700daa1cefc76b26d52e0:NetworkPkg/Dhcp6Dxe/Dhcp6Io.c",
        "ranges": [ { "startLine": 2519, "endLine": 2588 } ]
      }
    },
    {
      "name": "replay-Dhcp6Io.c-Dhcp6HandleAdvertiseMsg",
      "beforeSource": {
        "gitRevision": "1dbb10cc52dc8ef49bb700daa1cefc76b26d52e0^:NetworkPkg/Dhcp6Dxe/Dhcp6Io.c",
        "ranges": [ { "startLine": 2531, "endLine": 2673 } ]
      },
      "afterSource": {
        "gitRevision": "1dbb10cc52dc8ef49bb700daa1cefc76b26d52e0:NetworkPkg/Dhcp6Dxe/Dhcp6Io.c",
        "ranges": [ { "startLine": 2602, "endLine": 2744 } ]
      }
    },
    {
      "name": "replay-Dhcp6Io.c-Dhcp6HandleStateful",
      "beforeSource": {
        "gitRevision": "1dbb10cc52dc8ef49bb700daa1cefc76b26d52e0^:NetworkPkg/Dhcp6Dxe/Dhcp6Io.c",
        "ranges": [ { "startLine": 2682, "endLine": 2785 } ]
      },
      "afterSource": {
        "gitRevision": "1dbb10cc52dc8ef49bb700daa1cefc76b26d52e0:NetworkPkg/Dhcp6Dxe/Dhcp6Io.c",
        "ranges": [ { "startLine": 2753, "endLine": 2856 } ]
      }
    },
    {
      "name": "replay-Dhcp6Io.c-Dhcp6HandleStateless",
      "beforeSource": {
        "gitRevision": "1dbb10cc52dc8ef49bb700daa1cefc76b26d52e0^:NetworkPkg/Dhcp6Dxe/Dhcp6Io.c",
        "ranges": [ { "startLine": 2794, "endLine": 2887 } ]
      },
      "afterSource": {
        "gitRevision": "1dbb10cc52dc8ef49bb700daa1cefc76b26d52e0:NetworkPkg/Dhcp6Dxe/Dhcp6Io.c",
        "ranges": [ { "startLine": 2865, "endLine": 2958 } ]
      }
    },
    {
      "name": "replay-updateiainfo-1c440a5ece",
      "beforeSource": {
        "fixturePath": "cocci-scripts/tests/fixtures/CVE-2023-45229/Dhcp6UpdateIaInfo.before.c"
      },
      "afterSource": {
        "fixturePath": "cocci-scripts/tests/fixtures/CVE-2023-45229/Dhcp6UpdateIaInfo.after.c"
      }
    },
    {
      "name": "replay-Dhcp6Io.c-SeekStsOption-and-SeekInnerOptionSafe",
      "beforeSource": {
        "fixturePath": "cocci-scripts/tests/fixtures/CVE-2023-45229/Dhcp6SeekStsOption.before.c"
      },
      "afterSource": {
        "fixturePath": "cocci-scripts/tests/fixtures/CVE-2023-45229/Dhcp6SeekStsOption.after.c"
      }
    },
    {
      "name": "replay-Dhcp6Impl.h",
      "beforeSource": {
        "fixturePath": "cocci-scripts/tests/fixtures/CVE-2023-45229/Dhcp6Impl.h.before.c"
      },
      "afterSource": {
        "fixturePath": "cocci-scripts/tests/fixtures/CVE-2023-45229/Dhcp6Impl.h.after.c"
      }
    },
    {
      "name": "replay-Dhcp6Io.h",
      "beforeSource": {
        "gitRevision": "1c440a5eceedc64e892877eeac0f1a4938f5abbb^:NetworkPkg/Dhcp6Dxe/Dhcp6Io.h"
      },
      "afterSource": {
        "gitRevision": "1c440a5eceedc64e892877eeac0f1a4938f5abbb:NetworkPkg/Dhcp6Dxe/Dhcp6Io.h",
        "ranges": [
          { "startLine": 1, "endLine": 219 },
          { "startLine": 233, "endLine": 242 }
        ]
      }
    }
  ]
}
