{
  "id": "CVE-2022-36763",
  "cocciFile": "cocci-scripts/past-cves/CVE-2022-36763-tcg2-gpt-sanitize.cocci",
  "spatchOptions": [
    "--max-width", "200"
  ],
  "cases": [
    {
      "name": "replay-DxeTpmMeasureBootLib-TcgMeasureGptTable",
      "beforeSource": {
        "gitRevision": "4776a1b39e^:SecurityPkg/Library/DxeTpmMeasureBootLib/DxeTpmMeasureBootLib.c",
        "ranges": [
          { "startLine": 1, "endLine": 363 },
          { "startLine": 369, "endLine": 1013 }
        ]
      },
      "afterSource": {
        "gitRevision": "4776a1b39e:SecurityPkg/Library/DxeTpmMeasureBootLib/DxeTpmMeasureBootLib.c",
        "ranges": [
          { "startLine": 1, "endLine": 20 },
          { "startLine": 23, "endLine": 375 },
          { "startLine": 383, "endLine": 1027 }
        ]
      }
    },
    {
      "name": "replay-DxeTpm2MeasureBootLib-Tcg2MeasureGptTable",
      "beforeSource": {
        "gitRevision": "2244465432^:SecurityPkg/Library/DxeTpm2MeasureBootLib/DxeTpm2MeasureBootLib.c",
        "ranges": [
          { "startLine": 1, "endLine": 203 },
          { "startLine": 207, "endLine": 212 },
          { "startLine": 216, "endLine": 445 },
          { "startLine": 451, "endLine": 517 },
          { "startLine": 519, "endLine": 648 },
          { "startLine": 655, "endLine": 903 }
        ]
      },
      "afterSource": {
        "gitRevision": "2244465432:SecurityPkg/Library/DxeTpm2MeasureBootLib/DxeTpm2MeasureBootLib.c",
        "ranges": [
          { "startLine": 1, "endLine": 22 },
          { "startLine": 25, "endLine": 208 },
          { "startLine": 212, "endLine": 452 },
          { "startLine": 460, "endLine": 526 },
          { "startLine": 528, "endLine": 657 },
          { "startLine": 666, "endLine": 914 }
        ]
      }
    }
  ]
}
