{
  "id": "CVE-2024-38798",
  "cocciFile": "cocci-scripts/past-cves/CVE-2024-38798-keyboard-queue-clear.cocci",
  "spatchOptions": [
    "--max-width", "200"
  ],
  "cases": [
    {
      "name": "replay-ps2kbdctrller",
      "beforeSource": {
        "gitRevision": "0cad130cb4885961da201bb9b08424b3fd3d2249^:MdeModulePkg/Bus/Isa/Ps2KeyboardDxe/Ps2KbdCtrller.c"
      },
      "afterSource": {
        "gitRevision": "0cad130cb4885961da201bb9b08424b3fd3d2249:MdeModulePkg/Bus/Isa/Ps2KeyboardDxe/Ps2KbdCtrller.c"
      }
    },
    {
      "name": "replay-ps2kbdtextin",
      "beforeSource": {
        "gitRevision": "0cad130cb4885961da201bb9b08424b3fd3d2249^:MdeModulePkg/Bus/Isa/Ps2KeyboardDxe/Ps2KbdTextIn.c"
      },
      "afterSource": {
        "gitRevision": "0cad130cb4885961da201bb9b08424b3fd3d2249:MdeModulePkg/Bus/Isa/Ps2KeyboardDxe/Ps2KbdTextIn.c"
      }
    },
    {
      "name": "replay-usbkbdxe-keyboard",
      "beforeSource": {
        "gitRevision": "0cad130cb4885961da201bb9b08424b3fd3d2249^:MdeModulePkg/Bus/Usb/UsbKbDxe/KeyBoard.c"
      },
      "afterSource": {
        "gitRevision": "0cad130cb4885961da201bb9b08424b3fd3d2249:MdeModulePkg/Bus/Usb/UsbKbDxe/KeyBoard.c"
      }
    },
    {
      "name": "replay-consplitter",
      "beforeSource": {
        "gitRevision": "0cad130cb4885961da201bb9b08424b3fd3d2249^:MdeModulePkg/Universal/Console/ConSplitterDxe/ConSplitter.c"
      },
      "afterSource": {
        "gitRevision": "0cad130cb4885961da201bb9b08424b3fd3d2249:MdeModulePkg/Universal/Console/ConSplitterDxe/ConSplitter.c"
      }
    },
    {
      "name": "replay-terminalconin",
      "beforeSource": {
        "gitRevision": "0cad130cb4885961da201bb9b08424b3fd3d2249^:MdeModulePkg/Universal/Console/TerminalDxe/TerminalConIn.c"
      },
      "afterSource": {
        "gitRevision": "0cad130cb4885961da201bb9b08424b3fd3d2249:MdeModulePkg/Universal/Console/TerminalDxe/TerminalConIn.c"
      }
    },
    {
      "name": "replay-virtualkeyboard",
      "beforeSource": {
        "gitRevision": "ab04d09555b91037b8463ea5fb4387f16a5a5015^:EmbeddedPkg/Drivers/VirtualKeyboardDxe/VirtualKeyboard.c"
      },
      "afterSource": {
        "gitRevision": "ab04d09555b91037b8463ea5fb4387f16a5a5015:EmbeddedPkg/Drivers/VirtualKeyboardDxe/VirtualKeyboard.c"
      }
    }
  ]
}
