{
  "id": "CVE-2023-45236",
  "cocciFile": "cocci-scripts/past-cves/CVE-2023-45236-tcp-isn.cocci",
  "spatchOptions": [
    "--max-width", "100"
  ],
  "cases": [
    {
      "name": "replay-TcpTimer.c-tickingdpc",
      "beforeSource": {
        "gitRevision": "1904a64bcc^:NetworkPkg/TcpDxe/TcpTimer.c",
        "ranges": [
          { "startLine": 474, "endLine": 553 }
        ]
      },
      "afterSource": {
        "gitRevision": "1904a64bcc:NetworkPkg/TcpDxe/TcpTimer.c",
        "ranges": [
          { "startLine": 474, "endLine": 552 }
        ]
      }
    },
    {
      "name": "replay-TcpMisc.c-iss-global",
      "beforeSource": {
        "gitRevision": "1904a64bcc^:NetworkPkg/TcpDxe/TcpMisc.c",
        "ranges": [
          { "startLine": 18, "endLine": 37 }
        ]
      },
      "afterSource": {
        "gitRevision": "1904a64bcc:NetworkPkg/TcpDxe/TcpMisc.c",
        "ranges": [
          { "startLine": 18, "endLine": 21 },
          { "startLine": 27, "endLine": 27 },
          { "startLine": 33, "endLine": 36 },
          { "startLine": 44, "endLine": 50 },
          { "startLine": 52, "endLine": 64 }
        ]
      }
    },
    {
      "name": "replay-TcpMisc.c-init-tcb-local",
      "beforeSource": {
        "gitRevision": "1904a64bcc^:NetworkPkg/TcpDxe/TcpMisc.c",
        "ranges": [
          { "startLine": 45, "endLine": 85 }
        ]
      },
      "afterSource": {
        "gitRevision": "1904a64bcc:NetworkPkg/TcpDxe/TcpMisc.c",
        "ranges": [
          { "startLine": 75, "endLine": 146 }
        ]
      }
    },
    {
      "name": "replay-TcpMisc.c-onappconnect",
      "beforeSource": {
        "gitRevision": "1904a64bcc^:NetworkPkg/TcpDxe/TcpMisc.c",
        "ranges": [
          { "startLine": 725, "endLine": 735 }
        ]
      },
      "afterSource": {
        "gitRevision": "1904a64bcc:NetworkPkg/TcpDxe/TcpMisc.c",
        "ranges": [
          { "startLine": 933, "endLine": 951 }
        ]
      }
    },
    {
      "name": "replay-TcpInput.c-tcb-init-callsite",
      "beforeSource": {
        "gitRevision": "1904a64bcc^:NetworkPkg/TcpDxe/TcpInput.c",
        "ranges": [
          { "startLine": 709, "endLine": 1543 }
        ]
      },
      "afterSource": {
        "fixturePath": "cocci-scripts/tests/fixtures/CVE-2023-45236/TcpInput.after.c"
      }
    },
    {
      "name": "replay-TcpMisc.c-secret-typedefs-getisn",
      "beforeSource": {
        "gitRevision": "1904a64bcc^:NetworkPkg/TcpDxe/TcpMisc.c"
      },
      "afterSource": {
        "fixturePath": "cocci-scripts/tests/fixtures/CVE-2023-45236/TcpMisc.after.c"
      }
    },
    {
      "name": "replay-TcpDriver.c",
      "beforeSource": {
        "gitRevision": "1904a64bcc^:NetworkPkg/TcpDxe/TcpDriver.c"
      },
      "afterSource": {
        "fixturePath": "cocci-scripts/tests/fixtures/CVE-2023-45236/TcpDriver.after.c"
      }
    },
    {
      "name": "replay-TcpFunc.h",
      "beforeSource": {
        "gitRevision": "1904a64bcc^:NetworkPkg/TcpDxe/TcpFunc.h"
      },
      "afterSource": {
        "fixturePath": "cocci-scripts/tests/fixtures/CVE-2023-45236/TcpFunc.after.h"
      }
    },
    {
      "name": "replay-TcpMain.h",
      "beforeSource": {
        "gitRevision": "1904a64bcc^:NetworkPkg/TcpDxe/TcpMain.h"
      },
      "afterSource": {
        "fixturePath": "cocci-scripts/tests/fixtures/CVE-2023-45236/TcpMain.after.h"
      }
    }
  ]
}
