{
  "id": "CVE-2024-38796",
  "cocciFile": "cocci-scripts/past-cves/CVE-2024-38796-pecoff-reloc-overflow.cocci",
  "spatchOptions": [
    "--max-width", "200"
  ],
  "cases": [
    {
      "name": "replay-basepecoff",
      "beforeSource": {
        "gitRevision": "aedcaa3df8a246ef859c234ed5c243471c5be698^:MdePkg/Library/BasePeCoffLib/BasePeCoff.c"
      },
      "afterSource": {
        "gitRevision": "aedcaa3df8a246ef859c234ed5c243471c5be698:MdePkg/Library/BasePeCoffLib/BasePeCoff.c"
      }
    }
  ]
}
